<?xml version="1.0"?>
<!-- edited with XMLSPY v5 U (http://www.xmlspy.com) by tb (ul) -->
<!--Sample XML file generated by XMLSPY v5 U (http://www.xmlspy.com)-->
<complexTaskDef xmlns="http://complex.taskmodel.thorstenberger.de/complexTaskDef" xmlns:xsi="http://www.w3.org/2001/XMLSchema-instance" xsi:schemaLocation="http://complex.taskmodel.thorstenberger.de/complexTaskDef D:\elateworkspace\taskmodel\taskmodel-schema\src\main\jaxb\complexTaskDef.xsd">
	<config>
		<time>45</time>
		<tries>1000</tries>
		<tasksPerPage>2</tasksPerPage>
		<correctionMode>
			<regular/>
		</correctionMode>
	</config>
	<title>&#xDC;bungsklausur</title>
	<description>Diese &#xDC;bungsklausur hat zwei Funktionen: Einerseits sollen Sie mit der Benutzeroberfl&#xE4;che des Klausur-Moduls vertraut gemacht werden. Sie sollen lernen, wie die Multiple-Choice-Aufgaben funktionieren, wie Zuordnungsaufgaben aufgebaut sind, was sich hinter L&#xFC;ckentext-Aufgaben verbirgt und wie die Eingabe freier Antworten funktioniert. Dazu verwenden wir Aufgaben, die nicht unbedingt dem Vorlesungsstoff entnommen worden sind und nicht in jedem Fall mit tierischem Ernst zu nehmen sind. Andere Aufgaben sind n&#xE4;her am Klausurstoff und sollen Ihnen eine Vorstellung von Art und Umfang der Fragestellung vermitteln.</description>
	<startText>Hiermit starten Sie die &#xDC;bungsklausur. Sie k&#xF6;nnen zum &#xDC;ben mehrere Versuche starten.</startText>
	<category id="Kat_MC" title="Multiple Choice">
		<mcTaskBlock>
			<config noOfSelectedTasks="4" pointsPerTask="5.0" preserveOrder="false"/>
			<mc-config>
				<regular>
					<negativePoints>1.0</negativePoints>
				</regular>
			</mc-config>
			<mcSubTaskDef id="a1" category="multipleSelect" maxCorrectAnswers="4" minCorrectAnswers="1">
			
				<problem>bla bla bla</problem>
				<hint>bla bla bla</hint>
				<displayedAnswers>5</displayedAnswers>
				<correct id="c1">
  correctAnswer
</correct>
				<correct id="c2">
  correctAnswer
</correct>
				<correct id="c3">
  correctAnswer
</correct>
				<correct id="c4">
  correctAnswer
</correct>
				<incorrect id="i1">
  correctAnswer
</incorrect>
				
				<incorrect id="i2">
  correctAnswer
</incorrect>
				<incorrect id="i3">
  correctAnswer
</incorrect>
				<incorrect id="i4">
  correctAnswer
</incorrect>
			</mcSubTaskDef>
			<mcSubTaskDef id="a2" category="multipleSelect" maxCorrectAnswers="4" minCorrectAnswers="1">
				<problem>bla bla bla</problem>
				<hint>bla bla bla</hint>
				<displayedAnswers>5</displayedAnswers>
				<correct id="c1">
  correctAnswer
</correct>
				<correct id="c2">
  correctAnswer
</correct>
				<correct id="c3">
  correctAnswer
</correct>
				<correct id="c4">
  correctAnswer
</correct>
				<incorrect id="i1">
  correctAnswer
</incorrect>
				<incorrect id="i2">
  correctAnswer
</incorrect>
				<incorrect id="i3">
  correctAnswer
</incorrect>
				<incorrect id="i4">
  correctAnswer
</incorrect>
			</mcSubTaskDef>
			<mcSubTaskDef id="a3" category="multipleSelect" maxCorrectAnswers="4" minCorrectAnswers="1">
				<problem>bla bla bla</problem>
				<hint>bla bla bla</hint>
				<displayedAnswers>5</displayedAnswers>
				<correct id="c1">
  correctAnswer
</correct>
				<correct id="c2">
  correctAnswer
</correct>
				<correct id="c3">
  correctAnswer
</correct>
				<correct id="c4">
  correctAnswer
</correct>
				<incorrect id="i1">
  correctAnswer
</incorrect>
				<incorrect id="i2">
  correctAnswer
</incorrect>
				<incorrect id="i3">
  correctAnswer
</incorrect>
				<incorrect id="i4">
  correctAnswer
</incorrect>
			</mcSubTaskDef>
			<mcSubTaskDef id="a4" category="multipleSelect" maxCorrectAnswers="4" minCorrectAnswers="1">
				<problem>bla bla bla</problem>
				<hint>bla bla bla</hint>
				<displayedAnswers>5</displayedAnswers>
				<correct id="c1">
  correctAnswer
</correct>
				<correct id="c2">
  correctAnswer
</correct>
				<correct id="c3">
  correctAnswer
</correct>
				<correct id="c4">
  correctAnswer
</correct>
				<incorrect id="i1">
  correctAnswer
</incorrect>
				<incorrect id="i2">
  correctAnswer
</incorrect>
				<incorrect id="i3">
  correctAnswer
</incorrect>
				<incorrect id="i4">
  correctAnswer
</incorrect>
			</mcSubTaskDef>
		</mcTaskBlock>
	</category>
	<category id="Kat_Map" title="Zuordnung">
		<mappingTaskBlock>
			<config noOfSelectedTasks="3" pointsPerTask="5.0" preserveOrder="false"/>
			<mapping-config negativePoints="1.0"/>
			<mappingSubTaskDef id="map1">
				<problem>bla bla bla</problem>
				<concept name="name">
					<correctAssignmentID>4</correctAssignmentID>
				</concept>
				<concept name="name">
					<correctAssignmentID>1</correctAssignmentID>
				</concept>
				<concept name="name">
					<correctAssignmentID>5</correctAssignmentID>
				</concept>
				<concept name="name">
					<correctAssignmentID>2</correctAssignmentID>
				</concept>
				<concept name="name">
					<correctAssignmentID>3</correctAssignmentID>
				</concept>
				<assignment id="1" name="name"/>
				<assignment id="2" name="name"/>
				<assignment id="3" name="name"/>
				<assignment id="4" name="name"/>
				<assignment id="5" name="name"/>
			</mappingSubTaskDef>
			<mappingSubTaskDef id="map2">
				<problem>bla bla bla</problem>
				<concept name="name">
					<correctAssignmentID>1</correctAssignmentID>
				</concept>
				<concept name="name">
					<correctAssignmentID>4</correctAssignmentID>
				</concept>
				<concept name="name">
					<correctAssignmentID>5</correctAssignmentID>
				</concept>
				<concept name="name">
					<correctAssignmentID>3</correctAssignmentID>
				</concept>
				<concept name="name">
					<correctAssignmentID>2</correctAssignmentID>
				</concept>
				<assignment id="1" name="name"/>
				<assignment id="2" name="name"/>
				<assignment id="3" name="name"/>
				<assignment id="4" name="name"/>
				<assignment id="5" name="name"/>
			</mappingSubTaskDef>
			<mappingSubTaskDef id="map3">
				<problem>bla bla bla</problem>
				<concept name="name">
					<correctAssignmentID>3</correctAssignmentID>
				</concept>
				<concept name="name">
					<correctAssignmentID>3</correctAssignmentID>
				</concept>
				<concept name="name">
					<correctAssignmentID>1</correctAssignmentID>
				</concept>
				<concept name="name">
					<correctAssignmentID>2</correctAssignmentID>
				</concept>
				<concept name="name">
					<correctAssignmentID>5</correctAssignmentID>
				</concept>
				<assignment id="1" name="name"/>
				<assignment id="2" name="name"/>
				<assignment id="3" name="name"/>
				<assignment id="4" name="name"/>
				<assignment id="5" name="name"/>
			</mappingSubTaskDef>
		</mappingTaskBlock>
	</category>
	<category id="Kat_Cloze" title="L&#xFC;ckentext">
		<clozeTaskBlock>
			<config noOfSelectedTasks="3" pointsPerTask="5.0" preserveOrder="false"/>
			<cloze-config ignoreCase="true" negativePoints="1.0"/>
			<clozeSubTaskDef id="cloze1">
				<problem>bla bla bla</problem>
				<cloze>
					<text>bla bla bla</text>
					<gap inputLength="25">
						<correct>
  correctAnswer
</correct>
					</gap>
					<text>bla bla bla</text>
					<gap inputLength="25">
						<correct>
  correctAnswer
</correct>
					</gap>
					<text>bla bla bla</text>
					<gap inputLength="25">
						<correct>
  correctAnswer
</correct>
					</gap>
					<text>bla bla bla</text>
					<gap inputLength="25">
						<correct>
  correctAnswer
</correct>
					</gap>
					<text>bla bla bla</text>
					<gap inputLength="25">
						<correct>
  correctAnswer
</correct>
					</gap>
					<text>bla bla bla</text>
				</cloze>
			</clozeSubTaskDef>
			<clozeSubTaskDef id="cloze2">
				<problem>bla bla bla</problem>
				<cloze>
					<text>bla bla bla</text>
					<gap inputLength="25">
						<correct>
  correctAnswer
</correct>
					</gap>
					<text>bla bla bla</text>
					<gap inputLength="25">
						<correct>
  correctAnswer
</correct>
					</gap>
					<text>bla bla bla</text>
					<gap inputLength="25">
						<correct>
  correctAnswer
</correct>
					</gap>
					<text>bla bla bla</text>
					<gap inputLength="25">
						<correct>
  correctAnswer
</correct>
					</gap>
					<text>bla bla bla</text>
					<gap inputLength="25">
						<correct>
  correctAnswer
</correct>
					</gap>
					<text>bla bla bla</text>
				</cloze>
			</clozeSubTaskDef>
			<clozeSubTaskDef id="cloze3">
				<problem>bla bla bla</problem>
				<cloze>
					<text>bla bla bla</text>
					<gap inputLength="25">
						<correct>
  correctAnswer
</correct>
					</gap>
					<text>bla bla bla</text>
					<gap inputLength="25">
						<correct>
  correctAnswer
</correct>
					</gap>
					<text>bla bla bla</text>
					<gap inputLength="25">
						<correct>
  correctAnswer
</correct>
					</gap>
					<text>bla bla bla</text>
					<gap inputLength="25">
						<correct>
  correctAnswer
</correct>
					</gap>
					<text>bla bla bla</text>
					<gap inputLength="25">
						<correct>
  correctAnswer
</correct>
					</gap>
					<text>bla bla bla</text>
				</cloze>
			</clozeSubTaskDef>
		</clozeTaskBlock>
	</category>
	<category id="Kat_Text" title="Freier Text">
		<textTaskBlock>
			<config noOfSelectedTasks="1" pointsPerTask="5.0" preserveOrder="false"/>
			<textSubTaskDef id="text1">
				<problem>bla bla bla</problem>
				<correctionHint>hint hint</correctionHint>
			</textSubTaskDef>
		</textTaskBlock>
	</category>
	<revisions>
		<revision author="berger" date="1238976575748" serialNumber="1"/>
	</revisions>
</complexTaskDef>
